{
 "$schema": "https://json-schema.org/draft/2020-12/schema",
 "items": {
  "properties": {
   "kind": {
    "type": "string"
   },
   "sources": {
    "items": {
     "type": "string"
    },
    "type": "array"
   },
   "status": {
    "type": "string"
   },
   "what": {
    "type": "string"
   },
   "when": {
    "type": "string"
   },
   "who": {
    "type": "string"
   }
  },
  "required": [
   "kind",
   "sources",
   "status",
   "what",
   "when",
   "who"
  ],
  "type": "object"
 },
 "title": "exploitation.json",
 "type": "array"
}
